{
  "$comment": "GENERATED by bun nv render — do not edit",
  "$schema": "https://json-schema.org/draft/2020-12/schema",
  "title": "goal",
  "type": "object",
  "properties": {
    "title": {
      "type": "string"
    },
    "milestone": {
      "anyOf": [
        {
          "type": "string",
          "minLength": 1,
          "x-references": "milestone"
        },
        {
          "type": "null"
        }
      ]
    },
    "position": {
      "enum": [
        "last"
      ]
    },
    "sweep": {
      "enum": [
        "done"
      ]
    },
    "waitFor": {
      "type": "object",
      "properties": {
        "argv": {
          "type": "array",
          "items": {
            "type": "string"
          }
        },
        "want": {
          "type": "array",
          "items": {
            "type": "string"
          }
        },
        "absent": {
          "type": "array",
          "items": {
            "type": "string"
          }
        },
        "everyMin": {
          "type": "integer"
        }
      },
      "required": [
        "argv",
        "everyMin"
      ],
      "additionalProperties": false
    },
    "handover": {
      "enum": [
        "looper"
      ]
    },
    "files": {
      "type": "array",
      "items": {
        "type": "string"
      }
    },
    "context": {
      "type": "object",
      "properties": {
        "modules": {
          "type": "array",
          "items": {
            "type": "string"
          }
        },
        "rules": {
          "type": "array",
          "items": {
            "type": "string"
          }
        },
        "adrs": {
          "type": "array",
          "items": {
            "type": "string"
          }
        },
        "shapes": {
          "type": "array",
          "items": {
            "type": "string"
          }
        },
        "playbook": {
          "type": "array",
          "items": {
            "type": "string"
          }
        },
        "plan": {
          "type": "array",
          "items": {
            "type": "string"
          }
        },
        "milestones": {
          "type": "array",
          "items": {
            "type": "string"
          }
        }
      },
      "required": [],
      "additionalProperties": false
    },
    "stages": {
      "type": "array",
      "items": {
        "type": "object",
        "properties": {
          "number": {
            "type": "integer"
          },
          "title": {
            "type": "string"
          },
          "summary": {
            "type": "string"
          },
          "context": {
            "type": "object",
            "properties": {
              "modules": {
                "type": "array",
                "items": {
                  "type": "string"
                }
              },
              "rules": {
                "type": "array",
                "items": {
                  "type": "string"
                }
              },
              "adrs": {
                "type": "array",
                "items": {
                  "type": "string"
                }
              },
              "shapes": {
                "type": "array",
                "items": {
                  "type": "string"
                }
              },
              "playbook": {
                "type": "array",
                "items": {
                  "type": "string"
                }
              },
              "plan": {
                "type": "array",
                "items": {
                  "type": "string"
                }
              },
              "milestones": {
                "type": "array",
                "items": {
                  "type": "string"
                }
              }
            },
            "required": [],
            "additionalProperties": false
          }
        },
        "required": [
          "number",
          "title"
        ],
        "additionalProperties": false
      }
    },
    "checks": {
      "type": "array",
      "items": {
        "type": "object",
        "properties": {
          "id": {
            "type": "string",
            "pattern": "^[a-z0-9][a-z0-9-]*$"
          },
          "kind": {
            "enum": [
              "command",
              "cargo-named",
              "nvs-suite",
              "exact",
              "ordered",
              "contains",
              "min-bytes"
            ]
          },
          "stage": {
            "type": "integer"
          },
          "name": {
            "type": "string"
          },
          "argv": {
            "type": "array",
            "items": {
              "type": "string"
            }
          },
          "args": {
            "type": "array",
            "items": {
              "type": "string"
            }
          },
          "cwd": {
            "type": "string"
          },
          "tests": {
            "type": "array",
            "items": {
              "type": "string"
            }
          },
          "cases": {
            "type": "array",
            "items": {
              "type": "string"
            }
          },
          "file": {
            "type": "string"
          },
          "stream": {
            "enum": [
              "stdout",
              "stderr"
            ]
          },
          "want": {
            "type": "array",
            "items": {
              "type": "string"
            }
          },
          "exit": {
            "enum": [
              "nonzero"
            ]
          },
          "stdoutContains": {
            "type": "array",
            "items": {
              "type": "string"
            }
          },
          "stderrContains": {
            "type": "array",
            "items": {
              "type": "string"
            }
          },
          "minBytes": {
            "type": "integer"
          },
          "minPassing": {
            "type": "integer"
          },
          "needs": {
            "type": "string"
          },
          "setup": {
            "type": "boolean"
          },
          "memoize": {
            "type": "boolean"
          },
          "overlap": {
            "type": "boolean"
          }
        },
        "required": [
          "id",
          "kind",
          "stage"
        ],
        "additionalProperties": false
      }
    },
    "env": {
      "type": "object",
      "properties": {
        "docker": {
          "type": "object",
          "properties": {
            "compose": {
              "type": "string"
            },
            "services": {
              "type": "array",
              "items": {
                "type": "string"
              }
            },
            "memoizeOn": {
              "type": "array",
              "items": {
                "type": "string"
              }
            }
          },
          "required": [
            "compose",
            "services"
          ],
          "additionalProperties": false
        },
        "valgrind": {
          "type": "object",
          "properties": {
            "skip": {
              "type": "array",
              "items": {
                "type": "string"
              }
            }
          },
          "required": [
            "skip"
          ],
          "additionalProperties": false
        },
        "wsl": {
          "type": "object",
          "properties": {
            "targetDir": {
              "type": "string"
            }
          },
          "required": [
            "targetDir"
          ],
          "additionalProperties": false
        }
      },
      "required": [],
      "additionalProperties": false
    }
  },
  "required": [
    "title",
    "milestone",
    "files",
    "context",
    "stages",
    "checks",
    "env"
  ],
  "additionalProperties": false
}
