{
  "title": "Core\\Time\\Zone and 2 more",
  "milestone": null,
  "files": [],
  "context": {
    "modules": [
      "crates/nvs-stdlib/src/time.rs",
      "crates/nvs-stdlib/src/topic.rs",
      "crates/nvs-stdlib/src/totp.rs"
    ],
    "rules": [
      "testing/feature-proofs",
      "testing/a-failing-proof-is-fixed-or-recorded",
      "0134",
      "0026",
      "0117",
      "0004",
      "0088"
    ],
    "adrs": [
      "0134",
      "0079 §15"
    ],
    "shapes": [
      "A `.nvst` test case",
      "Feature proofs — an example, an attack, a bench, a `covers:` marker",
      "A commit message"
    ],
    "playbook": [
      "Tooling > the end",
      "Tooling > one call reads",
      "Tooling > a commit",
      "Tooling > a [context]*",
      "Tooling > another agent",
      "Writing a test case > a rule*",
      "Writing a test case > a -p*",
      "Writing a test case > an array literal*",
      "Writing a test case > two foreach headers*",
      "Running things > target/release/nvs.exe is"
    ],
    "plan": [
      "Open now",
      "Blocking"
    ]
  },
  "stages": [
    {
      "number": 2,
      "title": "the dossier",
      "summary": "Writes the feature proofs that every feature listed above still owes."
    }
  ],
  "checks": [
    {
      "id": "dossier-core-time-zone",
      "kind": "command",
      "stage": 2,
      "name": "dossier: Core\\Time\\Zone",
      "argv": [
        "python",
        "tools/dossier.py",
        "--verify",
        "--group",
        "Core\\Time\\Zone"
      ],
      "want": [
        "nothing owed",
        "0 failed",
        "0 failed"
      ]
    },
    {
      "id": "dossier-core-topic",
      "kind": "command",
      "stage": 2,
      "name": "dossier: Core\\Topic",
      "argv": [
        "python",
        "tools/dossier.py",
        "--verify",
        "--group",
        "Core\\Topic"
      ],
      "want": [
        "nothing owed",
        "0 failed",
        "0 failed"
      ]
    },
    {
      "id": "dossier-core-totp",
      "kind": "command",
      "stage": 2,
      "name": "dossier: Core\\Totp",
      "argv": [
        "python",
        "tools/dossier.py",
        "--verify",
        "--group",
        "Core\\Totp"
      ],
      "want": [
        "nothing owed",
        "0 failed",
        "0 failed"
      ]
    }
  ],
  "env": {
    "docker": {
      "compose": "tests/db/compose.yaml",
      "services": [
        "postgres",
        "redis"
      ],
      "memoizeOn": [
        "crates/nvs-server",
        "crates/nvs-db",
        "tests/db"
      ]
    },
    "valgrind": {
      "skip": [
        "examples/fatal.nvs",
        "examples/uncaught.nvs",
        "examples/cache-shared-socket.nvs",
        "examples/queue-sqlite.nvs",
        "examples/cache-shared-tls.nvs"
      ]
    },
    "wsl": {
      "targetDir": "/var/tmp/nvs-target-wsl"
    }
  }
}
